{
  "$schema": "https://json-schema.org/draft/2020-12/schema",
  "type": "object",
  "required": ["name", "version", "description", "author", "license", "keywords", "skills", "interface"],
  "properties": {
    "name": {"type": "string", "minLength": 1},
    "version": {"type": "string", "minLength": 1},
    "description": {"type": "string", "minLength": 1},
    "author": {"type": "object"},
    "license": {"type": "string"},
    "keywords": {"type": "array", "items": {"type": "string"}},
    "skills": {"type": "string", "minLength": 1},
    "interface": {
      "type": "object",
      "required": ["displayName", "shortDescription", "longDescription", "developerName", "category", "capabilities", "defaultPrompt"],
      "properties": {
        "displayName": {"type": "string"},
        "shortDescription": {"type": "string"},
        "longDescription": {"type": "string"},
        "developerName": {"type": "string"},
        "category": {"type": "string"},
        "capabilities": {"type": "array", "items": {"type": "string"}},
        "defaultPrompt": {"type": "array", "items": {"type": "string"}},
        "brandColor": {"type": "string"},
        "composerIcon": {"type": "string"},
        "logo": {"type": "string"}
      },
      "additionalProperties": true
    }
  },
  "additionalProperties": true
}
