{
  "name": "binary-ninja-mcp",
  "version": "0.1.0",
  "description": "Binary Ninja analysis skill with BNIL IL documentation and MCP server usage guide",
  "author": {
    "name": "xpn"
  },
  "license": "MIT",
  "keywords": [
    "binary-ninja",
    "reverse-engineering",
    "bnil",
    "decompiler",
    "mcp",
    "codex",
    "specter"
  ],
  "skills": "./skills/",
  "interface": {
    "displayName": "Binary Ninja MCP",
    "shortDescription": "Binary Ninja analysis skill with BNIL IL documentation and MCP server usage guide",
    "longDescription": "Binary Ninja analysis skill with BNIL IL documentation and MCP server usage guide",
    "developerName": "SpecterOps",
    "category": "Security",
    "capabilities": [
      "Read",
      "Write"
    ],
    "defaultPrompt": [
      "Use the Binjamcp plugin."
    ],
    "brandColor": "#00B36B"
  }
}
