{
  "name": "workflows-development",
  "version": "0.1.0",
  "description": "Development scaffolding, repository hygiene, security tooling, and implementation workflows for Specter Codex.",
  "author": {
    "name": "SpecterOps"
  },
  "license": "UNLICENSED",
  "keywords": [
    "codex",
    "specter",
    "workflows",
    "development",
    "engineering",
    "security-tooling"
  ],
  "skills": "./skills/",
  "interface": {
    "displayName": "Workflows Development",
    "shortDescription": "Development scaffolding, repository hygiene, git, and security tooling workflows.",
    "longDescription": "Focused Specter Codex workflows for repository hygiene, project scaffolding, README generation, complex git operations, and security tool proof-of-concept development.",
    "developerName": "SpecterOps",
    "category": "Productivity",
    "capabilities": [
      "Read",
      "Write"
    ],
    "defaultPrompt": [
      "Use Workflows Development to scaffold a Python utility.",
      "Use Workflows Development before a risky git merge.",
      "Use Workflows Development to scaffold a security utility."
    ],
    "brandColor": "#00B36B",
    "composerIcon": "./assets/icon.png",
    "logo": "./assets/icon.png"
  }
}
