{
  "name": "ops-mssql",
  "version": "0.1.0",
  "description": "Microsoft SQL Server reconnaissance, privilege mapping, and assessment workflows.",
  "author": {
    "name": "SpecterOps"
  },
  "license": "UNLICENSED",
  "keywords": [
    "codex",
    "specter",
    "ops",
    "mssql",
    "sql-server",
    "database",
    "assessment"
  ],
  "skills": "./skills/",
  "interface": {
    "displayName": "Ops MSSQL",
    "shortDescription": "Microsoft SQL Server assessment workflows.",
    "longDescription": "Focused workflows for MSSQL discovery, instance enumeration, privilege mapping, linked-server analysis, and assessment evidence capture.",
    "developerName": "SpecterOps",
    "category": "Security",
    "capabilities": [
      "Read",
      "Write"
    ],
    "defaultPrompt": [
      "Use Ops MSSQL to enumerate SQL Server exposure.",
      "Use Ops MSSQL to map SQL Server privileges and linked servers.",
      "Use Ops MSSQL to document assessment evidence."
    ],
    "brandColor": "#00B36B",
    "composerIcon": "./assets/icon.svg",
    "logo": "./assets/icon.svg"
  }
}
