{
  "name": "c2-extension-development",
  "version": "0.1.0",
  "description": "Cobalt Strike Aggressor, BOF development, and C2 extension reference workflows.",
  "author": {
    "name": "SpecterOps"
  },
  "license": "UNLICENSED",
  "keywords": [
    "codex",
    "specter",
    "c2",
    "extension",
    "development",
    "cobalt-strike",
    "aggressor",
    "bof",
    "beacon-object-file"
  ],
  "skills": "./skills/",
  "interface": {
    "displayName": "C2 Extension Development",
    "shortDescription": "Cobalt Strike Aggressor, BOF, and C2 extension workflows.",
    "longDescription": "Focused workflows for Beacon Object File development, Cobalt Strike Aggressor scripts, aliases, hooks, reference lookup, and C2 extension support.",
    "developerName": "SpecterOps",
    "category": "Security",
    "capabilities": [
      "Read",
      "Write"
    ],
    "defaultPrompt": [
      "Use C2 Extension Development to build a BOF.",
      "Use C2 Extension Development to write Aggressor Script.",
      "Use C2 Extension Development to look up BOF or Aggressor references."
    ],
    "brandColor": "#2C2677",
    "composerIcon": "./assets/icon.png",
    "logo": "./assets/icon.png"
  }
}
