{
  "name": "tradecraft-linux",
  "version": "0.1.0",
  "description": "Linux process injection, execution, persistence, and operator validation workflows.",
  "author": {
    "name": "SpecterOps"
  },
  "skills": "./skills/",
  "interface": {
    "displayName": "Tradecraft Linux",
    "shortDescription": "Linux process injection and execution workflows.",
    "longDescription": "Linux-focused workflows for process injection, execution tradecraft, persistence validation, service/user context, and operator evidence capture.",
    "developerName": "SpecterOps",
    "category": "Security",
    "capabilities": [
      "Read",
      "Write"
    ],
    "defaultPrompt": [
      "Use Tradecraft Linux to assess or implement Linux process injection."
    ],
    "brandColor": "#00B36B",
    "composerIcon": "./assets/icon.svg",
    "logo": "./assets/icon.svg"
  },
  "license": "UNLICENSED",
  "keywords": [
    "codex",
    "specter",
    "tradecraft",
    "linux",
    "process-injection",
    "persistence"
  ]
}
