{
  "name": "bloodhound-development",
  "version": "0.2.1",
  "description": "Operate isolated BHE environments, deliver BHE/BHCE changes, and run focused enterprise review and validation workflows.",
  "author": {
    "name": "SpecterOps"
  },
  "license": "UNLICENSED",
  "keywords": [
    "codex",
    "specterops",
    "bloodhound",
    "enterprise",
    "development",
    "playwright",
    "docker",
    "worktrees"
  ],
  "skills": "./skills/",
  "interface": {
    "displayName": "BloodHound Development",
    "shortDescription": "Develop and validate BHE/BHCE features safely.",
    "longDescription": "Internal workflows for isolated BloodHound Enterprise development stacks, product-change delivery, mutation-free enterprise review, BHE/BHCE compatibility, official sample-data ingest, browser validation, and PR readiness.",
    "developerName": "SpecterOps",
    "category": "Productivity",
    "capabilities": [
      "Read",
      "Write"
    ],
    "defaultPrompt": [
      "Set up an isolated BloodHound Enterprise development environment for this feature.",
      "Implement and deliver this BHE/BHCE change with parity and PR evidence.",
      "Run a review-only enterprise assessment of this immutable BHE/BHCE candidate."
    ],
    "brandColor": "#8E92EB",
    "composerIcon": "./assets/icon.png",
    "logo": "./assets/icon.png"
  }
}
