{
  "name": "reverse-engineering",
  "version": "0.1.0",
  "description": "Reverse engineering workflows and MCP-assisted binary analysis for Binary Ninja, Ghidra, and related tooling.",
  "author": {
    "name": "xpn"
  },
  "license": "MIT",
  "keywords": [
    "codex",
    "specter",
    "reverse-engineering",
    "binary-ninja",
    "mcp",
    "binary-analysis",
    "ghidra"
  ],
  "skills": "./skills/",
  "interface": {
    "displayName": "Reverse Engineering",
    "shortDescription": "Reverse engineering, Binary Ninja, and Ghidra analysis workflows.",
    "longDescription": "General reverse-engineering workflows for binary analysis, MCP-assisted Binary Ninja and Ghidra usage, BNIL references, Ghidra decompiler workflows, and future reversing tool integrations.",
    "developerName": "SpecterOps",
    "category": "Security",
    "capabilities": [
      "Read",
      "Write"
    ],
    "defaultPrompt": [
      "Use Reverse Engineering to analyze a binary with Binary Ninja.",
      "Use Ghidra MCP to inspect functions, strings, and xrefs.",
      "Use Reverse Engineering to plan a reversing workflow."
    ],
    "brandColor": "#00B36B",
    "composerIcon": "./assets/icon.png",
    "logo": "./assets/icon.png"
  }
}
